{
  "allowed_services": [
    "alertmanager",
    "api",
    "backtest-artifact-publisher",
    "backtest-job-runner",
    "blackbox",
    "domain-cli",
    "exchange-control",
    "exchange-execution",
    "job-runtime",
    "market-data-scheduler",
    "market-data-ws",
    "notification-dispatcher",
    "notification-report-scheduler",
    "openbao",
    "operational-health",
    "postgresql",
    "prometheus",
    "redis",
    "secret-init",
    "storage-migrations",
    "strategy-live-runner",
    "telegram-bot-worker",
    "web"
  ],
  "default_services": [
    "alertmanager",
    "api",
    "backtest-artifact-publisher",
    "backtest-job-runner",
    "blackbox",
    "exchange-control",
    "exchange-execution",
    "market-data-scheduler",
    "market-data-ws",
    "notification-dispatcher",
    "notification-report-scheduler",
    "openbao",
    "operational-health",
    "postgresql",
    "prometheus",
    "redis",
    "strategy-live-runner",
    "telegram-bot-worker",
    "web"
  ],
  "profile": "trading",
  "release_version": "0.1.0",
  "schema": "io.roehub.control-policy/v1alpha1",
  "services": {
    "alertmanager": {
      "command_sha256": "6e3e42eefaf58773cea8fd689dd2391a67c13a58a01309a9252d6d53af2acd6d",
      "environment_names": [],
      "image": "prom/alertmanager:v0.28.1@sha256:27c475db5fb156cab31d5c18a4251ac7ed567746a2483ff264516437a39b15ba",
      "mounts": [
        "./observability/alertmanager.yml:/etc/alertmanager/alertmanager.yml:ro",
        "alertmanager-data:/alertmanager"
      ],
      "release_reference": "prom/alertmanager:v0.28.1@sha256:27c475db5fb156cab31d5c18a4251ac7ed567746a2483ff264516437a39b15ba",
      "resources": {
        "cpus": "0.25",
        "memory": "192M"
      },
      "restart_allowed": false
    },
    "api": {
      "command_sha256": "e6c06d82f5458d4fb194997aa09a3e3ee01d24a6acfcb514bc9b849d7c3156be",
      "environment_names": [
        "IDENTITY_EXCHANGE_KEYS_KEK_B64_FILE",
        "IDENTITY_FAIL_FAST",
        "IDENTITY_LOCAL_ALLOW_INSECURE_LOCALHOST",
        "IDENTITY_LOCAL_ORIGIN",
        "IDENTITY_LOCAL_RP_ID",
        "IDENTITY_LOCAL_RP_NAME",
        "IDENTITY_PG_DSN",
        "IDENTITY_SESSION_ABSOLUTE_TTL_SECONDS",
        "IDENTITY_SESSION_IDLE_TTL_SECONDS",
        "NOTIFICATIONS_PG_DSN",
        "NUMBA_CACHE_DIR",
        "PGPASSFILE",
        "POSTGRES_DSN",
        "PYTHONUNBUFFERED",
        "ROEHUB_ENV",
        "ROEHUB_EXCHANGE_ACCOUNT_STATE_SYNC_ENABLED",
        "ROEHUB_EXCHANGE_CONNECTIONS_PUBLIC_ROUTES_ENABLED",
        "ROEHUB_EXCHANGE_CONTROL_INTERNAL_API_TOKEN_FILE",
        "ROEHUB_EXCHANGE_CONTROL_INTERNAL_BASE_URL",
        "ROEHUB_EXCHANGE_CONTROL_REAL_EXCHANGE_VALIDATION_ENABLED",
        "ROEHUB_EXCHANGE_EXECUTION_CONFIG",
        "ROEHUB_EXECUTION_STRATEGY_PRODUCER_ENABLED",
        "ROEHUB_NUMBA_CACHE_DIR",
        "ROEHUB_OPERATIONAL_HEALTH_URL",
        "ROEHUB_PG_BUDGET_REQUIRED",
        "ROEHUB_PG_BUDGET_ROOT",
        "ROEHUB_PROFILE",
        "ROEHUB_REDIS_HOST",
        "ROEHUB_REDIS_PASSWORD_FILE",
        "ROEHUB_REDIS_PORT",
        "ROEHUB_STORAGE_POSTGRES_DSN",
        "ROEHUB_STORAGE_REDIS_URL",
        "ROEHUB_STRATEGY_CONFIG",
        "STRATEGY_PG_DSN",
        "WEB_API_BASE_URL",
        "WEB_API_UPSTREAM_URL"
      ],
      "image": "roehub/runtime@sha256:35ad7fdd77e6aa6cbbcf5fc20b29184277b4400d0e8c97c24f46876a061b352f",
      "mounts": [
        "pg-budget:/run/roehub-pg-budget",
        "./service-config.json:/etc/roehub/service-config.json:ro",
        "./service-configs/indicators.yaml:/etc/roehub/indicators.yaml:ro",
        "./service-configs/market_data.yaml:/etc/roehub/market_data.yaml:ro",
        "runtime-secrets:/run/roehub-secrets:ro",
        "pg-trust:/run/roehub-pg-trust:ro",
        "./service-configs/strategy.yaml:/etc/roehub/strategy.yaml:ro",
        "artifacts:/var/lib/roehub/artifacts"
      ],
      "release_reference": "roehub/runtime@sha256:35ad7fdd77e6aa6cbbcf5fc20b29184277b4400d0e8c97c24f46876a061b352f",
      "resources": {
        "cpus": "1.0",
        "memory": "768M"
      },
      "restart_allowed": true
    },
    "backtest-artifact-publisher": {
      "command_sha256": "7ed74e246e58bcf501419c5baedd051ce1e81cf04001155ba1a261104e6feadf",
      "environment_names": [
        "IDENTITY_EXCHANGE_KEYS_KEK_B64_FILE",
        "IDENTITY_FAIL_FAST",
        "IDENTITY_LOCAL_ALLOW_INSECURE_LOCALHOST",
        "IDENTITY_LOCAL_ORIGIN",
        "IDENTITY_LOCAL_RP_ID",
        "IDENTITY_LOCAL_RP_NAME",
        "IDENTITY_PG_DSN",
        "IDENTITY_SESSION_ABSOLUTE_TTL_SECONDS",
        "IDENTITY_SESSION_IDLE_TTL_SECONDS",
        "NOTIFICATIONS_PG_DSN",
        "NUMBA_CACHE_DIR",
        "PGPASSFILE",
        "POSTGRES_DSN",
        "PYTHONUNBUFFERED",
        "ROEHUB_ENV",
        "ROEHUB_EXCHANGE_ACCOUNT_STATE_SYNC_ENABLED",
        "ROEHUB_EXCHANGE_CONTROL_INTERNAL_API_TOKEN_FILE",
        "ROEHUB_EXCHANGE_CONTROL_INTERNAL_BASE_URL",
        "ROEHUB_EXCHANGE_CONTROL_REAL_EXCHANGE_VALIDATION_ENABLED",
        "ROEHUB_EXCHANGE_EXECUTION_CONFIG",
        "ROEHUB_EXECUTION_STRATEGY_PRODUCER_ENABLED",
        "ROEHUB_NUMBA_CACHE_DIR",
        "ROEHUB_PG_BUDGET_REQUIRED",
        "ROEHUB_PG_BUDGET_ROOT",
        "ROEHUB_PROFILE",
        "ROEHUB_REDIS_HOST",
        "ROEHUB_REDIS_PASSWORD_FILE",
        "ROEHUB_REDIS_PORT",
        "ROEHUB_STORAGE_POSTGRES_DSN",
        "ROEHUB_STORAGE_REDIS_URL",
        "ROEHUB_STRATEGY_CONFIG",
        "STRATEGY_PG_DSN",
        "WEB_API_BASE_URL",
        "WEB_API_UPSTREAM_URL"
      ],
      "image": "roehub/runtime@sha256:35ad7fdd77e6aa6cbbcf5fc20b29184277b4400d0e8c97c24f46876a061b352f",
      "mounts": [
        "pg-budget:/run/roehub-pg-budget",
        "./service-config.json:/etc/roehub/service-config.json:ro",
        "./service-configs/indicators.yaml:/etc/roehub/indicators.yaml:ro",
        "./service-configs/market_data.yaml:/etc/roehub/market_data.yaml:ro",
        "runtime-secrets:/run/roehub-secrets:ro",
        "pg-trust:/run/roehub-pg-trust:ro",
        "./service-configs/backtest-artifacts.yaml:/etc/roehub/backtest-artifacts.yaml:ro",
        "artifacts:/var/lib/roehub/artifacts"
      ],
      "release_reference": "roehub/runtime@sha256:35ad7fdd77e6aa6cbbcf5fc20b29184277b4400d0e8c97c24f46876a061b352f",
      "resources": {
        "cpus": "1.0",
        "memory": "1024M"
      },
      "restart_allowed": false
    },
    "backtest-job-runner": {
      "command_sha256": "96ee68e5eb3b63e23aa243c83ff46cdbf2472422a144ac7bc10bcf156a3f019e",
      "environment_names": [
        "IDENTITY_EXCHANGE_KEYS_KEK_B64_FILE",
        "IDENTITY_FAIL_FAST",
        "IDENTITY_LOCAL_ALLOW_INSECURE_LOCALHOST",
        "IDENTITY_LOCAL_ORIGIN",
        "IDENTITY_LOCAL_RP_ID",
        "IDENTITY_LOCAL_RP_NAME",
        "IDENTITY_PG_DSN",
        "IDENTITY_SESSION_ABSOLUTE_TTL_SECONDS",
        "IDENTITY_SESSION_IDLE_TTL_SECONDS",
        "NOTIFICATIONS_PG_DSN",
        "NUMBA_CACHE_DIR",
        "PGPASSFILE",
        "POSTGRES_DSN",
        "PYTHONUNBUFFERED",
        "ROEHUB_ENV",
        "ROEHUB_EXCHANGE_ACCOUNT_STATE_SYNC_ENABLED",
        "ROEHUB_EXCHANGE_CONTROL_INTERNAL_API_TOKEN_FILE",
        "ROEHUB_EXCHANGE_CONTROL_INTERNAL_BASE_URL",
        "ROEHUB_EXCHANGE_CONTROL_REAL_EXCHANGE_VALIDATION_ENABLED",
        "ROEHUB_EXCHANGE_EXECUTION_CONFIG",
        "ROEHUB_EXECUTION_STRATEGY_PRODUCER_ENABLED",
        "ROEHUB_NUMBA_CACHE_DIR",
        "ROEHUB_PG_BUDGET_REQUIRED",
        "ROEHUB_PG_BUDGET_ROOT",
        "ROEHUB_PROFILE",
        "ROEHUB_REDIS_HOST",
        "ROEHUB_REDIS_PASSWORD_FILE",
        "ROEHUB_REDIS_PORT",
        "ROEHUB_STORAGE_POSTGRES_DSN",
        "ROEHUB_STORAGE_REDIS_URL",
        "ROEHUB_STRATEGY_CONFIG",
        "STRATEGY_PG_DSN",
        "WEB_API_BASE_URL",
        "WEB_API_UPSTREAM_URL"
      ],
      "image": "roehub/runtime@sha256:35ad7fdd77e6aa6cbbcf5fc20b29184277b4400d0e8c97c24f46876a061b352f",
      "mounts": [
        "pg-budget:/run/roehub-pg-budget",
        "./service-config.json:/etc/roehub/service-config.json:ro",
        "./service-configs/indicators.yaml:/etc/roehub/indicators.yaml:ro",
        "./service-configs/market_data.yaml:/etc/roehub/market_data.yaml:ro",
        "runtime-secrets:/run/roehub-secrets:ro",
        "pg-trust:/run/roehub-pg-trust:ro",
        "artifacts:/var/lib/roehub/artifacts"
      ],
      "release_reference": "roehub/runtime@sha256:35ad7fdd77e6aa6cbbcf5fc20b29184277b4400d0e8c97c24f46876a061b352f",
      "resources": {
        "cpus": "2.0",
        "memory": "2048M"
      },
      "restart_allowed": false
    },
    "blackbox": {
      "command_sha256": "f45f664465fed46f8c033f131bf4b229ea655bbe4767ec1170752ea4e379be9a",
      "environment_names": [],
      "image": "prom/blackbox-exporter:v0.27.0@sha256:a50c4c0eda297baa1678cd4dc4712a67fdea713b832d43ce7fcc5f9bea05094d",
      "mounts": [
        "./observability/blackbox.yml:/etc/blackbox_exporter/config.yml:ro"
      ],
      "release_reference": "prom/blackbox-exporter:v0.27.0@sha256:a50c4c0eda297baa1678cd4dc4712a67fdea713b832d43ce7fcc5f9bea05094d",
      "resources": {
        "cpus": "0.25",
        "memory": "128M"
      },
      "restart_allowed": false
    },
    "domain-cli": {
      "command_sha256": "7c07e785bde65c988be6078a7a3408f7d8c8db8be7c0c9b340e5f76249d66206",
      "environment_names": [
        "IDENTITY_EXCHANGE_KEYS_KEK_B64_FILE",
        "IDENTITY_FAIL_FAST",
        "IDENTITY_LOCAL_ALLOW_INSECURE_LOCALHOST",
        "IDENTITY_LOCAL_ORIGIN",
        "IDENTITY_LOCAL_RP_ID",
        "IDENTITY_LOCAL_RP_NAME",
        "IDENTITY_PG_DSN",
        "IDENTITY_SESSION_ABSOLUTE_TTL_SECONDS",
        "IDENTITY_SESSION_IDLE_TTL_SECONDS",
        "NOTIFICATIONS_PG_DSN",
        "NUMBA_CACHE_DIR",
        "PGPASSFILE",
        "POSTGRES_DSN",
        "PYTHONUNBUFFERED",
        "ROEHUB_ENV",
        "ROEHUB_EXCHANGE_ACCOUNT_STATE_SYNC_ENABLED",
        "ROEHUB_EXCHANGE_CONTROL_INTERNAL_API_TOKEN_FILE",